{
  "$schema": "https://json-schema.org/draft/2020-12/schema",
  "$id": "openmathmodel.contracts.v1.plan-proposal",
  "title": "PlanProposal",
  "description": "建模方案页正文投影：MODEL_PLANNING 阶段真实 LLM 节点的最新成功输出（审批门的确认对象）。节点侧已保证 recommended_plan_id 指向 plans 中的方案；llm_attempts 等过程杂项不进入本投影。",
  "type": "object",
  "properties": {
    "run_id": { "$ref": "#/$defs/run_id" },
    "plans": {
      "type": "array",
      "minItems": 1,
      "items": { "$ref": "#/$defs/plan_option" },
      "description": "候选方案列表（归约后 1~3 套：A 主候选 / B 可用基线 / C 条件回退；无监督者的单次调用路径为 A/B 两套）。"
    },
    "recommended_plan_id": {
      "type": "string",
      "description": "推荐方案的 id；审批「采用当前方案」即采纳该方案。"
    },
    "rationale": {
      "type": ["string", "null"],
      "description": "推荐理由（与数据规模、约束和评审标准的匹配度）；节点未给出时为 null。"
    },
    "assumptions": {
      "oneOf": [
        { "type": "null" },
        { "type": "array", "items": { "$ref": "#/$defs/assumption" } }
      ],
      "description": "模型假设表（H3）：全局假设（scope=global）与各方案特定假设（scope=方案 id），由方案阶段归约后的一次规范化调用整理，供方案页「模型假设」分页与后续论文引用。节点未产出（2026-09-05 之前的运行、模拟节点、规范化调用失败）时为 null。可选字段：旧消费者可忽略。"
    },
    "symbols": {
      "oneOf": [
        { "type": "null" },
        { "type": "array", "items": { "$ref": "#/$defs/symbol" } }
      ],
      "description": "符号表（H3）：题面共有的集合 / 参数（plan_id=null）与各方案自己的决策变量 / 目标（plan_id=方案 id），共享符号在前。未产出时为 null。可选字段：旧消费者可忽略。"
    },
    "updated_at": { "$ref": "#/$defs/timestamp" }
  },
  "required": ["run_id", "plans", "recommended_plan_id", "rationale", "updated_at"],
  "additionalProperties": false,
  "$defs": {
    "run_id": { "type": "string", "pattern": "^run_[0-9a-f]{32}$" },
    "timestamp": {
      "type": "string",
      "pattern": "^\\d{4}-\\d{2}-\\d{2}T\\d{2}:\\d{2}:\\d{2}(\\.\\d{1,6})?Z$",
      "description": "UTC ISO-8601，统一以 Z 结尾。"
    },
    "assumption": {
      "type": "object",
      "properties": {
        "id": { "type": "string", "minLength": 1, "description": "表内稳定编号：全局假设 G1、G2…，方案特定假设 <方案 id>1、<方案 id>2…（如 A1、B1）。" },
        "text": { "type": "string", "minLength": 1, "description": "假设陈述（一句话）。" },
        "scope": { "type": "string", "minLength": 1, "description": "适用范围：\"global\" 或 plans 中某个方案的 id。" },
        "basis": { "type": "string", "description": "依据：题面 / 数据画像 / 领域常识 / 简化需要；空串表示节点未给出。" },
        "impact": {
          "type": "string",
          "enum": ["low", "medium", "high"],
          "description": "假设不成立时对结论的影响程度。"
        },
        "status": {
          "type": "string",
          "enum": ["confirmed", "to_verify", "critical"],
          "description": "confirmed = 题面或数据直接支持；to_verify = 需在实验中用数据检验；critical = 影响大且需做敏感性 / 稳健性分析。"
        }
      },
      "required": ["id", "text", "scope", "basis", "impact", "status"],
      "additionalProperties": false
    },
    "symbol": {
      "type": "object",
      "properties": {
        "symbol": { "type": "string", "minLength": 1, "description": "符号本身，LaTeX 记法、不带 $ 定界（如 x_{ijt}、\\mathcal{I}）；前端按行内公式排版。" },
        "kind": {
          "type": "string",
          "enum": ["set", "parameter", "variable", "objective", "other"],
          "description": "集合 / 参数（含常数与输入数据）/ 决策变量或状态量 / 目标函数 / 其它。"
        },
        "definition": { "type": "string", "minLength": 1, "description": "含义（一句话）。" },
        "unit": { "type": ["string", "null"], "description": "单位；无量纲或不适用为 null。" },
        "range": { "type": ["string", "null"], "description": "取值范围或定义域（如「非负整数」「0…K_i」）；不适用为 null。" },
        "plan_id": { "type": ["string", "null"], "description": "所属方案 id；题面共有的集合 / 参数为 null。" }
      },
      "required": ["symbol", "kind", "definition", "unit", "range", "plan_id"],
      "additionalProperties": false
    },
    "plan_option": {
      "type": "object",
      "properties": {
        "id": { "type": "string", "description": "方案标识（如 A / B）。" },
        "name": { "type": "string", "description": "方法名。" },
        "approach": { "type": "string", "description": "核心思路与数学工具。" },
        "steps": {
          "type": "array",
          "items": { "type": "string" },
          "description": "可执行的实验步骤（能直接转成 Python 实验）。"
        },
        "risks": {
          "type": "array",
          "items": { "type": "string" },
          "description": "该方案的主要风险与失效条件。"
        }
      },
      "required": ["id", "name", "approach", "steps", "risks"],
      "additionalProperties": false
    }
  }
}
