{
  "run_id": "run_1a2b3c4d5e6f708192a3b4c5d6e7f809",
  "plans": [
    {
      "id": "A",
      "name": "整数规划",
      "approach": "MILP 建模，精确求解调度问题",
      "steps": ["定义决策变量与约束", "构造目标函数", "调用求解器求解"],
      "risks": ["规模过大时求解慢"]
    },
    {
      "id": "B",
      "name": "启发式",
      "approach": "贪心构造初始解 + 局部搜索改进",
      "steps": ["构造初始解", "迭代改进"],
      "risks": ["无最优性保证"]
    }
  ],
  "recommended_plan_id": "A",
  "rationale": "数据规模中等，精确解可行且利于评审",
  "updated_at": "2026-08-27T01:32:00.000000Z"
}
